"id","task_id/id","work_summary_type_id/id","name","hours","date","create_date","write_date","user_id/id"
"__export__.project_task_work_532329","__export__.project_task_71859","__export__.project_task_work_summary_type_30","22./ Meeting with project manager: Requirement 2, 3, 4 review, revised field's attributes and fields datatype, Learned and understood the Log Field (Magic Field) and Special Fields, Learned How to make own user group and category, Revised attrs, Understood the Requirement 7","1.0","2022-01-25 12:48:36","2022-01-25 12:52:06","2022-01-25 12:52:06","__export__.res_users_604"
"__export__.project_task_work_531993","__export__.project_task_71859","__export__.project_task_work_summary_type_30","21./ Requirement 6: Module name employee_ept and model name is employee.demo.ept created for the employee details and included tree, form, search view. >> Requirement 2,3,4,5,6 : Initially completed and gives desired output","1.0","2022-01-24 13:50:36","2022-01-24 13:52:16","2022-01-24 13:52:16","__export__.res_users_604"
"__export__.project_task_work_531992","__export__.project_task_71859","__export__.project_task_work_summary_type_30","20./ Requirement 5: Learned compute attribute and compute function: Made Module named product_ept included tree form and search view","1.0","2022-01-24 13:48:29","2022-01-24 13:50:30","2022-01-24 13:50:30","__export__.res_users_604"
"__export__.project_task_work_531991","__export__.project_task_71859","__export__.project_task_work_summary_type_30","19./ Learned Copy attribute, context: active_test: False, attrs, name field.  attrs: used to apply attribute conditionally in xml file","0.5","2022-01-24 13:45:47","2022-01-24 13:47:40","2022-01-24 13:50:30","__export__.res_users_604"
"__export__.project_task_work_531990","__export__.project_task_71859","__export__.project_task_work_summary_type_30","18./ Requirement 2,3,4: a Module named localization_ept created, For Requirement 2: Country Details: Name, Country Code, Active fields, Tree, Form, Search Views, Countries and Localization Menu, -->Requirement 3: State Details: Name, State Code, Country Name, Active, Tree, Form, Search View, Sates menu, Requirement 4: City Details: Editable Tree view search view, city menu and action. Requirement 2,3,4: Security: Used Sales_Team User: Own Documents Group, 1 field in each model is not copied during duplicating record","2.5","2022-01-24 13:38:02","2022-01-24 13:45:39","2022-01-24 13:50:30","__export__.res_users_604"
"__export__.project_task_work_531982","__export__.project_task_71859","__export__.project_task_work_summary_type_30","17./ Watched the video on log fields and special field:  1. Log Fields: also known as Magic Fields are created and handled by the odoo frame work. fields are id: it is a primary key auto-increment id, create_date: date when the record is created, created_uid: User who created the record or by whom the record is created, write_date: date at which record is modified, write_uid: by whom record is modified,  -->> 2. Special Field: name: In odoo everything is addressed by the name, active: whether the record is in use or not, sequence: defines priority of that field, parent_id: defined id of the parent, company_id: Id of the company which is using erp. _rec_name: can use another field as a name","2.0","2022-01-24 13:29:13","2022-01-24 13:37:57","2022-01-24 13:37:57","__export__.res_users_604"
"__export__.project_task_work_531958","__export__.project_task_71859","__export__.project_task_work_summary_type_30","16./ Reviewed and watched the video about fields attributes and that are: required, readonly, copy, index, invisible, default","1.0","2022-01-24 13:24:29","2022-01-24 13:28:41","2022-01-24 13:28:41","__export__.res_users_604"
"__export__.project_task_work_531951","__export__.project_task_71859","__export__.project_task_work_summary_type_30","15./ Meeting with Project Manager: Requirement 1 reviewed, Given the task to find out about ""attrs"" in odoo, and find out details about name field in odoo, -->>Requirement 2,3,4: Information Gathering and Understanding the Problem statement. ","0.5","2022-01-24 13:20:06","2022-01-24 13:24:24","2022-01-24 13:24:24","__export__.res_users_604"
"__export__.project_task_work_531665","__export__.project_task_71859","__export__.project_task_work_summary_type_30","14./ Requirement 1: Module 4: completed and tested.  ->> Information gathering and understanding the task 4th Module of Requirement 1 is res_partner_demo_ept4 and model name is res.partner.demo.ept4 and it has name, email, street1, street2, city, state, country, zip_code, age, birthdate, weight, is_spectacle, gender, description, details etc field and created tree, form and search view, window action, 3 menuitems, search by name, city, state, country, zipcode and group by gender, country, state, city and filtered by Male, Female and Spectacles.  -->> created notebook view.  ==>> Requirement 1: Initially Completed and gives desired output. ---x--","1.0","2022-01-22 08:09:58","2022-01-22 08:13:08","2022-01-22 08:13:08","__export__.res_users_604"
"__export__.project_task_work_531664","__export__.project_task_71859","__export__.project_task_work_summary_type_30","14./ Requirement 1: Module 3: completed and tested.  ->> Information gathering and understanding the task 3rd Module of Requirement 1 is res_partner_demo_ept3 and model name is res.partner.demo.ept3 and it has name, email, street1, street2, city, state, country, zip_code, age, birthdate, weight, is_spectacle, gender, description, details etc field and created tree, form and search view, window action, 3 menuitems, search by name, city, state, country, zipcode and group by gender, country, state, city and filtered by Male, Female and Spectacles.  -->> created notebook view.","1.75","2022-01-22 08:09:00","2022-01-22 08:09:48","2022-01-22 08:13:08","__export__.res_users_604"
"__export__.project_task_work_531765","__export__.project_task_72108","__export__.project_task_work_summary_type_149","Meeting: Training - Campus to Corporate","1.25","2022-01-22 05:45:00","2022-01-24 04:42:49","2022-01-24 04:42:49","__export__.res_users_604"
"__export__.project_task_work_531720","__export__.project_task_71859","__export__.project_task_work_summary_type_111","Meeting or seminar on Campus to Corporate, It was about the journey from campus to corporate environment, We have learned what are the requirements of the corporate and how people for corporate can be an assets or a liability. We have given the task to perform our swot analysis.","1.5","2022-01-22 03:50:17","2022-01-24 03:51:16","2022-01-24 03:51:16","__export__.res_users_604"
"__export__.project_task_work_531427","__export__.project_task_71859","__export__.project_task_work_summary_type_27",".Learned to create the notebook view in form view and understood  it's attributes and sub-elements.","0.25","2022-01-21 13:52:04","2022-01-21 13:53:44","2022-01-21 13:54:00","__export__.res_users_604"
"__export__.project_task_work_531423","__export__.project_task_71859","__export__.project_task_work_summary_type_39","Written and described the work as Task Summary and listed the performed activity during the entire day.","0.416666666667","2022-01-21 13:49:07","2022-01-21 13:51:11","2022-01-21 13:53:44","__export__.res_users_604"
"__export__.project_task_work_531416","__export__.project_task_71859","__export__.project_task_work_summary_type_30","14./ Requirement 1: Module 2: completed and tested.  ->> Information gathering and understanding the task 2nd Module of Requirement 1 is res_partner_demo_ept2 and model name is res.partner.demo.ept2 and it has name, email, street1, street2, city, state, country, zip_code, age, birthdate, weight, is_spectacle, gender, description, details etc field and created tree, form and search view, window action, 3 menuitems, search by name, city, state, country, zipcode and group by gender, country, state, city and filtered by Male, Female and Spectacles.  -->> created notebook view.","2.0","2022-01-21 13:48:14","2022-01-21 13:48:53","2022-01-21 13:54:43","__export__.res_users_604"
"__export__.project_task_work_531414","__export__.project_task_71859","__export__.project_task_work_summary_type_30","14./ Requirement 1: Module 1: completed and tested.  ->> Information gathering and understanding the task 1st Module of Requirement 1 is res_partner_demo_ept1 and model name is res.partner.demo.ept1 and it has name, email, street1, street2, city, state, country, zip_code, age, birthdate, weight, is_spectacle, gender, description, details etc field and created tree, form and search view, window action, 3 menuitems, search by name, city, state, country, zipcode and group by gender, country, state, city and filtered by Male, Female and Spectacles.  -->> created notebook view.","3.0","2022-01-21 13:40:58","2022-01-21 13:46:56","2022-01-21 13:48:53","__export__.res_users_604"
"__export__.project_task_work_531410","__export__.project_task_71859","__export__.project_task_work_summary_type_30","13./ Watched Last Module creation video, which describes the folder structure, configuration file, Model creation, models.py and fields.py framework file structure, view file creation ir.ui.view, tree view, form view, search view, ir.action.act_window, menuitems, access security, data file...","1.0","2022-01-21 13:36:22","2022-01-21 13:40:51","2022-01-21 13:40:51","__export__.res_users_604"
"__export__.project_task_work_531200","__export__.project_task_71859","__export__.project_task_work_summary_type_30","12./ Meeting with Project Manager: Discussed about Module creation: revised configuration file and it's parameters, addons path, Creating a Module, __init__.py and __manifest__.py file, folder Structure, discussed the Parameters inside manifest file, model creation, odoo framework source code overview of models.py file and fields.py file and classes, properties of that classes inside that files, views files and specifying that files in manifest file, record creation of ir.ui.view, ir.actions.act_window, ir.ui.menu, etc.., setting security access rights to model using csv file, mentioning dependent modules in manifest file, sequence of import and depends in manifest file.  ==>> Requirement 1: explained, given task to implement and Learn Notebook View.","1.83333333333","2022-01-21 06:23:17","2022-01-21 06:58:29","2022-01-21 06:58:29","__export__.res_users_604"
"__export__.project_task_work_531096","__export__.project_task_71859","__export__.project_task_work_summary_type_30","11./ Watched 1st video on Module creating and created a Real Estate Module for learning purposes, defined and created Model, BaseModel, Fields, xml file inside view folder that has tree view, form view, search view, action: ir.actions.act_window, 3 menuitems element and learned record tag. created a ir.model.access.csv file for access right of that model and Tested and Verified the output.","3.0","2022-01-20 13:55:22","2022-01-20 14:01:00","2022-01-20 14:01:00","__export__.res_users_604"
"__export__.project_task_work_531095","__export__.project_task_71859","__export__.project_task_work_summary_type_30","10./ Folder Structure: Module Folder, __init__.py file and it's importance of sequence of import,   __manifest__.py file importance of sequence of data file, and depends files, models, views, wizard, reports, controllers, security, static, data.","0.5","2022-01-20 13:50:40","2022-01-20 13:55:12","2022-01-20 13:55:12","__export__.res_users_604"
"__export__.project_task_work_531094","__export__.project_task_71859","__export__.project_task_work_summary_type_30","9./ Meeting with project manager: Discussed about 1. Module 2. Model: model contains business logic and in loose definition it is a set or records or a table, Logical partition : Business Model and Framework Model, Technical Partition: Model, Abstract Model, Transient Model, Odoo Model: ir.model,  3. Fields: Odoo Model: ir.model.fields, Datatypes of fields and attributes of fields, 4. View: visual element or UI list view, kanban view, calendar view, pivot view, graph view, activity view, form view, search view, we can specify multiple view on single model, 5. Action: what to do, can load view, run script in background, Types of action: Window, Server, Client, URL, Report. Odoo Model: ir.actions.actions, ir.actions.act_window. 6. Menu: Top Level Menu, and Other sub Menu, Odoo model: ir.ui.menu, 7./ Security: Odoo Model: ir.model.access, ir.rule, res.groups whole topic covered    ==>> Special Mention Domain and Context in ir.actions.act_window table records, view and view xml id sequence in ir.actions.act_window","2.0","2022-01-20 13:33:36","2022-01-20 13:50:25","2022-01-20 13:50:25","__export__.res_users_604"
"__export__.project_task_work_530831","__export__.project_task_71859","__export__.project_task_work_summary_type_30","8./ Security: Odoo Model: ir.model.access, 2 types of rules: Access Rule and Record Rule, Access Rule defines create, read, update, delete access right to various user groups on Model and Menu. -> Record Rule or filter: Mode: ir.rule, it is CRUD activity tracker or trigger, It defines rule that allow valid user to read certain record or perform operation. It is second level security. For example: A salesperson can only access orders which are created by him only. while records created by other salesperson will not be visible to current salesperson. Global Rule: Applicable to all users, Group Rule: Applicable to particular user, Rule Applicable to user = Global Rule 1 and Global Rule 2 and ... and (Group Rule 1 or Group Rule 2 or ...)","1.0","2022-01-20 03:54:55","2022-01-20 04:04:48","2022-01-20 04:19:51","__export__.res_users_604"
"__export__.project_task_work_530810","__export__.project_task_71859","__export__.project_task_work_summary_type_30","7./ Menu: screen shown after login is called main dashboard, and apps in it are called Top Level Menu, Odoo Model: ir.ui.menu, defines menu hierarchy and lists menu that has action associated with it.","1.0","2022-01-20 03:50:17","2022-01-20 03:53:49","2022-01-20 04:04:48","__export__.res_users_604"
"__export__.project_task_work_530760","__export__.project_task_71859","__export__.project_task_work_summary_type_30","6./ Views: list view, kanban view, calendar view, pivot view, graph view, activity view, form view, search view.  -> we can define multiple views for a single model also.  -=> Action: defines what to do. can load view, run a script in background, attached to model. called form menu or contextual menu, types of action: ->> Window, Server, Client, URL, Report, Schedule Action or Cron Job, Odoo model: ir.actions.actions, ir.actions.act_window","2.0","2022-01-19 13:50:55","2022-01-19 13:53:07","2022-01-20 04:04:48","__export__.res_users_604"
"__export__.project_task_work_530617","__export__.project_task_71859","__export__.project_task_work_summary_type_30","5./ Fields: Fields are basically like column in database but in odoo we call it field instead of column. Likewise Fields also have datatypes. In Odoo datatypes of fields are Integer, Float, Boolean, Char, Html, Binary, Image, ManytoOne, OnetoMany etc...,   -=> Attributes: required, readonly, copy, index, invisible,default etc.. ","2.0","2022-01-19 10:11:31","2022-01-19 10:16:29","2022-01-19 10:16:29","__export__.res_users_604"
"__export__.project_task_work_530612","__export__.project_task_71859","__export__.project_task_work_summary_type_30","4./ Model: Model is basically a folder or a database table in loose definition. Model handles business logic and communicates with database to perform and fulfil the needs of that business logic.   -=> Model, Transient Model, Abstract Model, Transient Model : Stores Data Temporary, It may used in wizards or popup screens because in such cases we don't need that data in future after our work is completed similarly can be used to generate reports.","2.0","2022-01-19 10:01:11","2022-01-19 10:11:16","2022-01-19 10:11:16","__export__.res_users_604"
"__export__.project_task_work_530608","__export__.project_task_71859","__export__.project_task_work_summary_type_30","3./ Module: Watched the video and understood that every thing in odoo is module and how we can install and upgrade the module, Developer Mode in Odoo.","0.333333333333","2022-01-19 09:58:05","2022-01-19 10:01:04","2022-01-19 10:01:04","__export__.res_users_604"
"__export__.project_task_work_530605","__export__.project_task_71859","__export__.project_task_work_summary_type_30","2./ Meeting with Project Manager Videos are given to us and explained the work and learning process.","0.25","2022-01-19 09:56:26","2022-01-19 09:58:00","2022-01-19 09:58:00","__export__.res_users_604"
"__export__.project_task_work_530500","__export__.project_task_71859","__export__.project_task_work_summary_type_30","1./ Created a Module named 'estate' and it's model for learning purposes and installed that module, Read 3 chapters from Odoo documentation and understood the use of Manifest file and it's configuration. Currently Learning Views and creation of menu, and generating UI with xml file","2.0","2022-01-19 05:58:05","2022-01-19 05:58:12","2022-01-19 06:19:20","__export__.res_users_604"
"__export__.project_task_work_530567","__export__.project_task_71258","__export__.project_task_work_summary_type_30","4./ GitHub Repository odoo_exercise_1 created. Created new PyCharm project for Odoo and project name is Odoo, Project has Odoo Community and Enterprise edition, added the addons paths of odoo built-in addons, custom addons and Enterprise addons to the configuration file. Created A Module named 'estate' and created estate.properties model for it and installed that module into Odoo.","3.0","2022-01-18 09:03:00","2022-01-19 09:03:10","2022-01-19 09:10:22","__export__.res_users_604"
"__export__.project_task_work_530504","__export__.project_task_71258","__export__.project_task_work_summary_type_30","3./ Odoo Configuration with PyCharm, PostgreSQL configuration, odoo configuration file, dependencies installation, python version upgrade, odoo database creation, odoo ui overview, created a model in odoo, Watched videos Odoo pycharm configuration, odoo sales, inventory, purchase modules and overview of process of business operations. Overview of Odoo source code and odoo modules. Overview of architecture of odoo and odoo ORM layer, Model, Controller, View, Menu, Fields, Actions and Security.","3.5","2022-01-18 06:06:23","2022-01-19 06:13:42","2022-01-19 09:00:31","__export__.res_users_604"
"__export__.project_task_work_530502","__export__.project_task_71258","__export__.project_task_work_summary_type_30","2./ Understood ERP and Odoo: Learned ERP use-cases and analysed the use of ERP in real life with example,  ->Odoo -> Suite of Business applications, Community edition: Execution environment and Built-in Modules, Enterprise edition: Enterprise Modules, Model: business logic, View xml, Controller: connector, Action, Fields, Menu, Security Overview","3.0","2022-01-18 06:03:44","2022-01-19 06:06:16","2022-01-19 09:00:31","__export__.res_users_604"
"__export__.project_task_work_530501","__export__.project_task_71258","__export__.project_task_work_summary_type_30","1./ Meeting with project manager ->ERP: Discussed about ERP (what is ERP?), funcitons and uses of ERP, discussed some use-cases of ERP, and defined the purpose of ERP.  ->Framework:  what is Framework, what are the advantages of using framework, MVC architecture.  -> Odoo :  what is Odoo, python, xml, javascript, css, html, Community and Enterprise Edition, why odoo, what are the modules...","0.75","2022-01-18 05:59:54","2022-01-19 06:00:49","2022-01-19 09:01:20","__export__.res_users_604"
"__export__.project_task_work_529875","__export__.project_task_70974","__export__.project_task_work_summary_type_30","28./ XML Node types and constants, Node object properties, node object methods. --> xml.dom.minidom  - parse(), parseString(), file.firstChild.tagName, getElementsByTagName(), getAttribute(), hasAttribute(), .childNodes, .attributes, .attributes.items(), getDOMImplementation().  --> CSV module  -  csv.reader(), csv.writer(), writerow(), writerows(), csv.DIctReader(), csv.DictWriter(), next(), DIctWriter.writeheader(). --> OpenPyXl module -  workbook, worksheet, create_sheet(), title, copy_worksheet(), cell(), iter_rows(), iter_cols(), append(), save(), load_workbook().","2.0","2022-01-17 11:38:57","2022-01-17 11:47:17","2022-01-17 11:47:17","__export__.res_users_604"
"__export__.project_task_work_529870","__export__.project_task_70974","__export__.project_task_work_summary_type_30","27./ Revision of Python Math module (min(), max(), abs(), pow(), sqrt(), ceil(), floor(), math.pi),  -->  JSON (JavaScript Object Notation) (loads(), dumps(), Format JSON output and format separators) Python objects that can be converted into JSON are dict, list, tuple, str, int, float, True, False, None. JSON types are object, Array, String, Number, true, false, null. --> Try Except revised try, except, finally, else, raise --> Revised User Input input() method.  --> String Format, multiple values, index number, Named indexes. --> File Handling open(), Modes (r - read, a - append, w - write, x - create, t - text, b - binary) read(), readline(), readlines(), close(), append(). --> os Module -  os.remove(), os.path.exists(), os.rmdir()","4.0","2022-01-17 11:36:15","2022-01-17 11:36:26","2022-01-17 11:36:26","__export__.res_users_604"
"__export__.project_task_work_530191","__export__.project_task_71258","__export__.project_task_work_summary_type_30","28./ XML Node types and constants, Node object properties, node object methods. --> xml.dom.minidom  - parse(), parseString(), file.firstChild.tagName, getElementsByTagName(), getAttribute(), hasAttribute(), .childNodes, .attributes, .attributes.items(), getDOMImplementation().  --> CSV module  -  csv.reader(), csv.writer(), writerow(), writerows(), csv.DIctReader(), csv.DictWriter(), next(), DIctWriter.writeheader(). --> OpenPyXl module -  workbook, worksheet, create_sheet(), title, copy_worksheet(), cell(), iter_rows(), iter_cols(), append(), save(), load_workbook().","2.0","2022-01-17 08:53:41","2022-01-18 08:53:53","2022-01-18 08:54:49","__export__.res_users_604"
"__export__.project_task_work_530188","__export__.project_task_71258","__export__.project_task_work_summary_type_30","27./ Revision of Python Math module (min(), max(), abs(), pow(), sqrt(), ceil(), floor(), math.pi),  -->  JSON (JavaScript Object Notation) (loads(), dumps(), Format JSON output and format separators) Python objects that can be converted into JSON are dict, list, tuple, str, int, float, True, False, None. JSON types are object, Array, String, Number, true, false, null. --> Try Except revised try, except, finally, else, raise --> Revised User Input input() method.  --> String Format, multiple values, index number, Named indexes. --> File Handling open(), Modes (r - read, a - append, w - write, x - create, t - text, b - binary) read(), readline(), readlines(), close(), append(). --> os Module -  os.remove(), os.path.exists(), os.rmdir()","3.0","2022-01-17 08:52:48","2022-01-18 08:52:58","2022-01-19 06:00:49","__export__.res_users_604"
"__export__.project_task_work_529603","__export__.project_task_71258","__export__.project_task_work_summary_type_30","26./ Program 11 --> Missing functionality remaining hours added comments added and Done.  --> Program 9 --> Issue with Order State is resolved and created a Improved version of program in 2.py file which has slightly less code complexity in change_order_state() method and comments are added.  --> Program 12 --> comments are added, Issue with Order State and Delivery State is resolved and slightly reduced the code complexity of change_order_state() and change_delivery_order_state() method.","2.0","2022-01-15 06:35:33","2022-01-15 06:35:42","2022-01-19 06:00:49","__export__.res_users_604"
"__export__.project_task_work_529593","__export__.project_task_71258","__export__.project_task_work_summary_type_30","25./ Meeting with Project Manager --> reviewed the Program 9 ---> Issue with Order State is found and comments are not added to program by me..    --> Program 10 --> Reviewed and Done.  --> Program 11 --> Reviewed and found remaining hours functionality missing  --> Program 12 -->  reviewed and found issue with delivery order State and comments are not added by me..","0.666666666667","2022-01-15 06:21:31","2022-01-15 06:25:51","2022-01-15 06:25:51","__export__.res_users_604"
"__export__.project_task_work_529392","__export__.project_task_71258","__export__.project_task_work_summary_type_30","24./ Program 12 --> Initially Done and gives desired output. class Sales_Order created and it inherits SalesTransaction class It has prepare_delivery_order() method, manage_delivery_order() method, create_delivery_order() method, set_order_state_to_confirm() method inherit and called manage_delivery_order() from it, display_delivery_order() method, change_delivery_order_status() method, cancel_delivery_order() method, validate_delivery_order() method inherits set_order_to_done() method.","2.5","2022-01-13 10:59:57","2022-01-13 11:28:45","2022-01-19 06:00:49","__export__.res_users_604"
"__export__.project_task_work_529393","__export__.project_task_71258","__export__.project_task_work_summary_type_27","23./ Program 12 --> Analysed the requirements gathered the information and states the problem definition of program. Menu Driven Program 1. Validate Delivery 2. Cancel Order Delivery options in the menu added, new Dictionary called delivery_order needs to be created when order state is confirmed.","2.5","2022-01-13 10:54:00","2022-01-13 11:28:45","2022-01-13 11:28:45","__export__.res_users_604"
