"id","task_id/id","work_summary_type_id/id","name","hours","date","create_date","write_date","user_id/id"
"__export__.project_task_work_529377","__export__.project_task_71258","__export__.project_task_work_summary_type_30","22./ Program 11 --> Initially Done and gives desired output. I have used filter() method, map() method, list() constructor and sum() method. Thus I have learned and understood that items in nested dictionaries can be accessed without using loops. I have learned and understood how items in dictionaries can be filtered to get different Results","2.5","2022-01-13 10:41:17","2022-01-13 10:53:51","2022-01-13 10:53:51","__export__.res_users_604"
"__export__.project_task_work_529368","__export__.project_task_71258","__export__.project_task_work_summary_type_30","21./ Program 10 --> Initially Done and gives desired output. I have used functools.reduce() method, filter() method and sum() method to solve this program. Thus I have understood that items nested list can be accessed without using loops.","1.5","2022-01-13 10:37:52","2022-01-13 10:41:00","2022-01-13 10:53:51","__export__.res_users_604"
"__export__.project_task_work_529364","__export__.project_task_71258","__export__.project_task_work_summary_type_30","20./ Program 9 --> Errors in order state and order_lines state are solved. Separate function created for Set to Draft, Set to Confirm, Set to Done and Set to Cancel. Thus improves code re-usability.","2.0","2022-01-13 10:33:30","2022-01-13 10:37:40","2022-01-13 10:37:40","__export__.res_users_604"
"__export__.project_task_work_529064","__export__.project_task_71258","__export__.project_task_work_summary_type_30","19./ Meeting with Project Manager --> program 6, 7, 8 evaluated ,  -->Program 9 --> Description and problem definition and input, output are given. Basic Structure of program and way of coding are explained","0.616666666667","2022-01-12 13:24:20","2022-01-12 13:27:26","2022-01-12 13:27:26","__export__.res_users_604"
"__export__.project_task_work_529061","__export__.project_task_71258","__export__.project_task_work_summary_type_30","18./ Program 9 --> Initially Done and gives desired output.   --->    product_details dictionary, product_stock dictionary, customer_details dictionary, customer_address dictionary, order_details_dictionary, manage_product() function, prepare_product() function, create_product() function, manage_customer() function, prepare_customer() function, create_customer() function, generate_order() function, prepare_order() function, prepare_order_lines() function, create_sales_order function, display_products() function, display_customers() function, display_sales_order() function, update_product() function, change_order_state() function, generate_invoice() function.    --> Issues and Errors Solved all Functionalities are implemented.","4.0","2022-01-12 13:21:28","2022-01-12 13:23:39","2022-01-15 06:35:27","__export__.res_users_604"
"__export__.project_task_work_529050","__export__.project_task_71258","__export__.project_task_work_summary_type_27","17./ Analysing The Requirements of Program 9 --> Menu Driven Program,   --> Program 9 Video watched, that described the functionality, input, output, code re-usability and readability.   --> Understood why i should create separate function for user_input or preparation, manager function to pass input data to appropriate method, and create function to create dictionary or assigning values to global variable or properties.   Thus enhancing code re-usability (function can be inherited in future), readability and reducing redundancy ","5.0","2022-01-12 13:11:53","2022-01-12 13:12:12","2022-01-15 06:35:27","__export__.res_users_604"
"__export__.project_task_work_528738","__export__.project_task_71258","__export__.project_task_work_summary_type_30","16./ Meeting with Project Manager : Program 4 is evaluated and reviewed","0.5","2022-01-11 13:52:41","2022-01-11 13:53:43","2022-01-11 13:53:43","__export__.res_users_604"
"__export__.project_task_work_528739","__export__.project_task_71258","__export__.project_task_work_summary_type_27","15./ Program 9 --> Read the whole problem definition and understood the requirements. Requirements of the programs are Product Dictionary, Customer Dictionary, Sales_Order Dictionary, prepare_product() method, prepare_customer method, manage_product() method, prepare_order_lines() method, prepare_sales_order() method, Create a Menu from which user can navigate through and select appropriate choice to call a method or enter required fields, unique incremental sku with prefix PRD as a key in product dictionary, unique incremental customer id with prefix c as key in customer dictionary, unique incremental sales_order dictionary id as a key","4.0","2022-01-11 13:43:11","2022-01-11 13:53:43","2022-01-11 13:53:43","__export__.res_users_604"
"__export__.project_task_work_528724","__export__.project_task_71258","__export__.project_task_work_summary_type_30","14./ Program 6 --> Removed Unnecessary for loop from the program thus simplifies the program and enhance the readability","0.25","2022-01-11 13:40:59","2022-01-11 13:43:05","2022-01-11 13:43:05","__export__.res_users_604"
"__export__.project_task_work_528536","__export__.project_task_71258","__export__.project_task_work_summary_type_30","13./ Learned openpyxl module and its funcitons like Workbook(), create_sheet(), title(), append(), save(), active(), cell(), load_workbook(), close(), and properties like max_column, max_row.  --> Program 8 --> Initially Done and gives desired output.","1.5","2022-01-11 07:14:08","2022-01-11 07:18:32","2022-01-11 07:18:32","__export__.res_users_604"
"__export__.project_task_work_528534","__export__.project_task_71258","__export__.project_task_work_summary_type_30","12./ Learned csv module methods like writer(), reader(), writerow(), writerows(), open(), accessing through index number.   --> Program 7 --> Initially done and gives desired output. ","0.5","2022-01-11 07:10:31","2022-01-11 07:13:59","2022-01-11 07:13:59","__export__.res_users_604"
"__export__.project_task_work_528532","__export__.project_task_71258","__export__.project_task_work_summary_type_30","11./ Program 6 error solved --> Error was due to looping through csv.reader iterable object 2 times which returns empty list on second loop. Solving Error --> Created a new list variable that stores reader object value and looping, reading value from that list variable","2.5","2022-01-11 06:54:31","2022-01-11 07:10:14","2022-01-11 07:10:14","__export__.res_users_604"
"__export__.project_task_work_528352","__export__.project_task_71258","__export__.project_task_work_summary_type_30","10./ Program 6 --> Progress halted, dictionary from csv file is created, cannot be able to add dictionaries to orderlines list","1.0","2022-01-10 13:48:18","2022-01-10 13:51:05","2022-01-10 13:51:05","__export__.res_users_604"
"__export__.project_task_work_528353","__export__.project_task_71258","__export__.project_task_work_summary_type_30","9./ Learned CSV module of Python. Learned functionality of csv module like reader() function and implementing it with keyword instead of try Except. Learned use of with keyword, Learned to access row as list and row element from csv file, Learned to access fields as a list from csv file","1.0","2022-01-10 13:41:49","2022-01-10 13:51:05","2022-01-10 13:51:05","__export__.res_users_604"
"__export__.project_task_work_528351","__export__.project_task_71258","__export__.project_task_work_summary_type_30","8./ Issues is previous Program is resolved Program 4 total_product_quantity is added, Program 4 requirements and functionality added and fulfilled.   --> Program 5 is Initially completed reading from XML file","1.5","2022-01-10 13:39:41","2022-01-10 13:41:44","2022-01-10 13:41:44","__export__.res_users_604"
"__export__.project_task_work_528343","__export__.project_task_71258","__export__.project_task_work_summary_type_30","7./ Meeting with Project Manager: Program 2 and 3 are analysed and evaluated some readability issues are found,    --> Requirements of Program 4 and 5 are defined, Problem definition is given, and sample output is given","0.666666666667","2022-01-10 13:32:24","2022-01-10 13:37:06","2022-01-10 13:37:06","__export__.res_users_604"
"__export__.project_task_work_528333","__export__.project_task_71258","__export__.project_task_work_summary_type_30","6./ Learning xml.dom.minidom module and it's functions and properties, Learning about DOM (Document Object Model), Learning about XML node types, In xml.dom.mindom module I have learned about parse function, childNodes, ELEMENT_NODE, tagName, nodeName, getAttribute() method, getElementsByTagName() method, firstChild","2.0","2022-01-10 13:21:59","2022-01-10 13:32:18","2022-01-10 13:32:18","__export__.res_users_604"
"__export__.project_task_work_528301","__export__.project_task_71258","__export__.project_task_work_summary_type_30","5./ Learning and Revising some Python Concepts and functions like map(), filter(), zip(), reduce(), accumulate(), all(), any(), sum(), Dict Comprehension, loop through dictionary, sorted() key = , dict sort by value, itemgetter(), use of itemgetter in sorted function, use of itemgetter along with map function in sorted funciton of operator module","3.0","2022-01-10 13:13:49","2022-01-10 13:21:50","2022-01-10 13:21:50","__export__.res_users_604"
"__export__.project_task_work_528021","__export__.project_task_71258","__export__.project_task_work_summary_type_30","3./ Program 1 --> Revised Created a simplified version some issues resolved and Tested.   --> Program 2 --> Initially Done. and Tested has 4 classes (Manufacturing, Purchase(Manufacturing), Scrapping(Manufacturing), Product(Manufacturing))  -->  Program 3 --> Initially done and Tested --> Program 4 --> Initially Done and Tested      4./  All 4 Programs pushed to remote GitHub Directory python_exercise_2  5./ Analysis of program 4 and Indexed, Incremental Dictionary Creation, Update, Item Fetching requirements are analysed","3.0","2022-01-08 08:12:30","2022-01-08 08:25:40","2022-01-15 06:35:27","__export__.res_users_604"
"__export__.project_task_work_528020","__export__.project_task_71258","__export__.project_task_work_summary_type_30","4./ Meeting with Project Manager: Program 1 evaluated, readability and functionality Issue raised, Discussed about Program 2 Requirements and Functionality","0.5","2022-01-08 06:06:56","2022-01-08 08:25:40","2022-01-08 08:25:40","__export__.res_users_604"
"__export__.project_task_work_527749","__export__.project_task_71258","__export__.project_task_work_summary_type_30","2./ Program 1  --> Initially Done   --> GitHub Repository Created  -->PyCharm Project Created  --> Problem Analysed, Problem Defined, Logic Building, Coding, Testing   --> Some Additional Functionality added   --> Program 1 pushed to remote Repository","1.5","2022-01-07 14:04:11","2022-01-07 14:09:15","2022-01-07 14:10:20","__export__.res_users_604"
"__export__.project_task_work_527750","__export__.project_task_71258","__export__.project_task_work_summary_type_39","Previous Task work summary Listed and Described","0.25","2022-01-07 14:02:17","2022-01-07 14:09:15","2022-01-07 14:09:15","__export__.res_users_604"
"__export__.project_task_work_527751","__export__.project_task_71258","__export__.project_task_work_summary_type_30","1./ Meeting with Project Manager: Explained the Task, GitHub Repository name, Do's and Don't in process of completing task","0.75","2022-01-07 13:59:12","2022-01-07 14:09:15","2022-01-07 14:09:15","__export__.res_users_604"
"__export__.project_task_work_527646","__export__.project_task_70978","__export__.project_task_work_summary_type_30","3./ As per Guidance given in the Meeting I have fixed Errors, Readability and Efficiency Issues in the Program.  Some New Concepts are learned and Implemented on the programs like -->  all(), any(), sum(), reduce(), zip(), Dictionary Comprehension, sorted(), itemgetter(), loop through key:val pair using items(), Multiple Inheritance       x==> Task Completed","2.5","2022-01-07 12:09:45","2022-01-07 12:16:15","2022-01-07 12:16:44","__export__.res_users_604"
"__export__.project_task_work_527559","__export__.project_task_70978","__export__.project_task_work_summary_type_39","Listed and Described the Task","0.166666666667","2022-01-07 09:07:31","2022-01-07 09:08:28","2022-01-07 09:08:28","__export__.res_users_604"
"__export__.project_task_work_527557","__export__.project_task_70978","__export__.project_task_work_summary_type_30","2./ Meeting with Project Manager: Programs is reviewed by PM, Issues with Code Readability and Code Efficiency in my code is discussed and highlighted,  --> Suggested things like (all() fq, sum() fq, dict comprehension, diff bet list() and copy(), sorted() and itemgetter(), and use of dict.items() in for loop), --> Suggested to implement Multiple inheritance in Order, Product and Customer program where Order should inherit Customer and Product class.","1.75","2022-01-07 08:55:24","2022-01-07 09:06:46","2022-01-07 09:06:46","__export__.res_users_604"
"__export__.project_task_work_527558","__export__.project_task_70978","__export__.project_task_work_summary_type_30","1./ Revised Git and GitHub concepts like branch, areas like (Untracked files, Modified files, Staging area, Local Repository, Remote Repository), Commands like (checkout, branch, clone, log, add, commit)","2.0","2022-01-07 08:50:54","2022-01-07 09:06:46","2022-01-07 09:06:46","__export__.res_users_604"
"__export__.project_task_work_527354","__export__.project_task_70978","__export__.project_task_work_summary_type_30","1./ Created new GitHub Repository (python_exercise_1),  2./ Python Exercise 1 : All 38 programs of the exercise are done but may need to revise if some of them can be optimised or can be able to shorten by using functions like lambda, filter, map, reduce, zip;  -> I have pushed all the programs of python exercise 1 into GitHub Repository python_exercise_1 on branch shyamg;  -> Most Frequent concepts I have used and covered in programs are: variable, datatypes, Set, Tuple, List, Dictionary, List Comprehention, Arbitary Arguments, List or Tuple inside Dictionary, Nested Dictionaries, Looping Through Iterable objects(list, tuple, set etc..), Various Methods of accessing dictionary and Iterable object's items, Functions, Lambda Functions, Filter Function, Map Function, Range Function, Inheritance ( Multi Level Inheritance)","8.5","2022-01-06 13:27:34","2022-01-06 13:39:33","2022-01-07 04:49:20","__export__.res_users_604"
"__export__.project_task_work_527136","__export__.project_task_70978","__export__.project_task_work_summary_type_27","1./ Analyse and Review The Programs,   2./ Logic Building, Writing Program Definitions, Solving Errors, Generating Algorithm or steps of solving the program  3./ Rewriting some programs","1.5","2022-01-06 08:54:29","2022-01-06 08:59:59","2022-01-07 04:47:59","__export__.res_users_604"
"__export__.project_task_work_527458","__export__.project_task_70978","__export__.project_task_work_summary_type_68","Employment Induction Feedback Survey","0.25","2022-01-06 04:52:42","2022-01-07 04:56:15","2022-01-07 04:56:15","__export__.res_users_604"
"__export__.project_task_work_527448","__export__.project_task_70978","__export__.project_task_work_summary_type_39","Listed and Described the Task that i have completed","0.5","2022-01-06 04:47:04","2022-01-07 04:47:59","2022-01-07 04:47:59","__export__.res_users_604"
"__export__.project_task_work_527447","__export__.project_task_70974","__export__.project_task_work_summary_type_39","Listed and Described the Task That I have completed","0.5","2022-01-05 04:38:34","2022-01-07 04:40:23","2022-01-07 04:40:23","__export__.res_users_604"
"__export__.project_task_work_527446","__export__.project_task_70974","__export__.project_task_work_summary_type_30","1./ Meeting with Project Manager  2./ Python Understanding(Python Variables, Python Data Types, Python Strings, (count, endswith, find, format, index, isspace, lstrip, replace, rfind, rindex, rstrip, zfill, strip, join), Python List, Python Dictionaries, Copying dictionary, Merge dictionaries, Iterating through dictionaries, Fetch value from dictionary, Python Tuples, Python Set, Python Functions, How to define a functions, Call one function from another, Learn how to return value from one function, Python Lambda, Python Built-in Functions, map, Python Class/Objects, Python Inheritance, Python Dates, Find no of Days between two dates, Find Day of the date, Find month of the date, Find year of the date, Convert string to date, Subtract n no of days from a date and find that date, Add year to a date Find date of next Tuesday or Wednesday, Add month to a date, Find no of months between two dates, Find no of years between two dates, Python String Format) are covered Python Understanding Task and it is completed.  3./  Fatching items from Nested Dictionary and List, Nested List or Tuple inside Dictionary  4./ Multi Level Inheritance Program","7.0","2022-01-05 04:30:35","2022-01-07 04:38:10","2022-01-07 04:38:10","__export__.res_users_604"
"__export__.project_task_work_527444","__export__.project_task_70974","__export__.project_task_work_summary_type_30","GitHub SSH Key Generating, Adding Generated SSH Key to GitHub, Generated GitHub Token","1.0","2022-01-04 04:35:47","2022-01-07 04:38:10","2022-01-07 04:38:10","__export__.res_users_604"
"__export__.project_task_work_527445","__export__.project_task_70974","__export__.project_task_work_summary_type_39","Listed and Described the tasks that i have completed, Learned functionality of the Task, Projects and Work entry in ERP","1.0","2022-01-04 04:31:56","2022-01-07 04:38:10","2022-01-07 04:38:10","__export__.res_users_604"
"__export__.project_task_work_527439","__export__.project_task_70974","__export__.project_task_work_summary_type_30","1./ Meeting with Project Manager  2./ GitHub Repository (python_learning) & Video, PyCharm Configuration & Video, Task Video,  3./ Python Understanding(Python Variables, Python Data Types, Python Strings, (count, endswith, find, format, index, isspace, lstrip, replace, rfind, rindex, rstrip, zfill, strip, join), Python List, Python Dictionaries, Copying dictionary, Merge dictionaries, Iterating through dictionaries, Fetch value from dictionary, Python Tuples, Python Set, Python Functions, How to define a functions, Call one function from another, Learn how to return value from one function, Python Lambda, Python Built-in Functions, Python Class Object, Python Inheritance)","6.0","2022-01-04 04:28:21","2022-01-07 04:29:12","2022-01-07 04:29:12","__export__.res_users_604"
"__export__.project_task_work_526191","__export__.project_task_70955","__export__.project_task_work_summary_type_46","Meeting: On Boarding || Reviewing ERP","2.0","2022-01-03 13:30:00","2022-01-03 13:41:53","2022-01-03 13:41:53","__export__.res_users_604"
"__export__.project_task_work_526184","__export__.project_task_70954","__export__.project_task_work_summary_type_46","Meeting: On Boarding || ERP Review","8.0","2022-01-03 11:30:00","2022-01-03 13:41:10","2022-01-03 13:41:10","__export__.res_users_604"
